Date,Article_title,Stock_symbol,Url,Publisher,Author,Article,Lsa_summary,Luhn_summary,Textrank_summary,Lexrank_summary
2019-07-16T08:00:00.000+08:00,Big Tech Grilled On Capitol Hill (Wall Street Breakfast Podcast),JPM,https://seekingalpha.com/article/4275147-big-tech-grilled-capitol-hill-wall-street-breakfast-podcast?source=partner_benzinga,Seeking Alpha,,,,,,
2019-07-16T08:00:00.000+08:00,Muted Trading Performance to Hurt BofA's (BAC) Q2 Earnings,JPM,http://www.zacks.com/stock/news/442862/muted-trading-performance-to-hurt-bofas-bac-q2-earnings?cid=CS-BENZ-FT-442862,Zacks,,,,,,
2019-07-16T08:00:00.000+08:00,"JPMorgan Q2 reflects strong consumer, weaker i-banking, trading revenue",JPM,https://seekingalpha.com/news/3477982-jpmorgan-q2-reflects-strong-consumer-weaker-banking-trading-revenue?source=partner_benzinga,Seeking Alpha,,,,,,
2019-07-16T08:00:00.000+08:00,Wall Street Breakfast: Big Tech Grilled On Capitol Hill,JPM,https://seekingalpha.com/article/4275132-wall-street-breakfast-big-tech-grilled-capitol-hill?source=partner_benzinga,Seeking Alpha,,,,,,
2019-07-16T08:00:00.000+08:00,JPMorgan Chase & Co. 2019 Q2 - Results - Earnings Call Slides,JPM,https://seekingalpha.com/article/4275140-jpmorgan-chase-and-co-2019-q2-results-earnings-call-slides?source=partner_benzinga,Seeking Alpha,,,,,,
2019-07-16T08:00:00.000+08:00,"JPMorgan Chase EPS beats by $0.33, beats on revenue",JPM,https://seekingalpha.com/news/3477971-jpmorgan-chase-eps-beats-0_33-beats-revenue?source=partner_benzinga,Seeking Alpha,,,,,,
2019-07-17T08:00:00.000+08:00,A Mostly On-Target Citigroup Slowly Grinding Higher,JPM,https://seekingalpha.com/article/4275617-mostly-target-citigroup-slowly-grinding-higher?source=partner_benzinga,Seeking Alpha,,,,,,
2019-07-17T08:00:00.000+08:00,Buy American Express Stock Ahead of Q2 Earnings Report?,JPM,http://www.zacks.com/stock/news/444096/buy-american-express-stock-ahead-of-q2-earnings-report?cid=CS-BENZ-FT-444096,Zacks,,,,,,
2019-07-17T08:00:00.000+08:00,The Race To Zero: Price Wars In The Asset Management Industry,JPM,https://seekingalpha.com/article/4275538-race-zero-price-wars-asset-management-industry?source=partner_benzinga,Seeking Alpha,,,,,,
2019-07-17T08:00:00.000+08:00,Citigroup - Staying On Course,JPM,https://seekingalpha.com/article/4275533-citigroup-staying-course?source=partner_benzinga,Seeking Alpha,,,,,,
2019-07-17T08:00:00.000+08:00,ClearBridge Appreciation Strategy Portfolio Manager Commentary Q2 2019,JPM,https://seekingalpha.com/article/4275522-clearbridge-appreciation-strategy-portfolio-manager-commentary-q2-2019?source=partner_benzinga,Seeking Alpha,,,,,,
2019-07-17T08:00:00.000+08:00,The Retirees' Dividend Portfolio - John And Jane's June Taxable Account Update: The Danger Of Making Assumptions,JPM,https://seekingalpha.com/article/4275483-retirees-dividend-portfolio-john-janes-june-taxable-account-update-danger-making-assumptions?source=partner_benzinga,Seeking Alpha,,,,,,
2019-07-17T08:00:00.000+08:00,JPMorgan Is Undervalued,JPM,https://seekingalpha.com/article/4275471-jpmorgan-undervalued?source=partner_benzinga,Seeking Alpha,,,,,,
2019-07-17T08:00:00.000+08:00,JPMorgan Chase June card charge-off rate declines,JPM,https://seekingalpha.com/news/3478458-jpmorgan-chase-june-card-charge-rate-declines?source=partner_benzinga,Seeking Alpha,,,,,,
2019-07-17T08:00:00.000+08:00,"Comerica (CMA) Q2 Earnings Lag Estimates, Revenues Rise",JPM,http://www.zacks.com/stock/news/443614/comerica-cma-q2-earnings-lag-estimates-revenues-rise?cid=CS-BENZ-FT-443614,Zacks,,,,,,
2019-07-17T08:00:00.000+08:00,"First Horizon (FHN) Q2 Earnings & Revenues Beat, Stock Up",JPM,http://www.zacks.com/stock/news/443601/first-horizon-fhn-q2-earnings-revenues-beat-stock-up?cid=CS-BENZ-FT-443601,Zacks,,,,,,
2019-07-17T08:00:00.000+08:00,First Of The FAANGs To Report (Wall Street Breakfast Podcast),JPM,https://seekingalpha.com/article/4275377-first-faangs-report-wall-street-breakfast-podcast?source=partner_benzinga,Seeking Alpha,,,,,,
2019-07-18T08:00:00.000+08:00,"Resource Planning Group Buys Vanguard Growth, Vanguard Short-Term Bond, Vanguard ...",JPM,http://www.gurufocus.com/news/911376/resource-planning-group-buys-vanguard-growth-vanguard-shortterm-bond-vanguard-intermediateterm-bond-sells-pimco-investment-grade-corporate-bond-index-exchan-total-system-services-inc,GuruFocus,,,,,,
2019-07-18T08:00:00.000+08:00,Buy Visa (V) Heading into Q3 Earnings?,JPM,http://www.zacks.com/stock/news/445034/buy-visa-v-heading-into-q3-earnings?cid=CS-BENZ-FT-445034,Zacks,,,,,,
2019-07-18T08:00:00.000+08:00,"Dow Jones Heads For Weekly Loss; These Growth Stocks, Indexes Ignore Netflix Drop",JPM,http://www.investors.com/market-trend/stock-market-today/dow-jones-heads-for-weekly-loss-growth-stocks-indexes-ignore-netflix-drop/?src=A00237A&ven=BenzingaCP&src=AURLAAM,Investor's Business Daily,,,,,,
2019-07-18T08:00:00.000+08:00,Morgan Stanley (MS) Beats on Q2 Earnings Amid Trading Woes,JPM,http://www.zacks.com/stock/news/444390/morgan-stanley-ms-beats-on-q2-earnings-amid-trading-woes?cid=CS-BENZ-FT-444390,Zacks,,,,,,
2019-07-18T08:00:00.000+08:00,SunTrust (STI) Q2 Earnings Decline Y/Y Despite Revenue Growth,JPM,http://www.zacks.com/stock/news/444845/suntrust-sti-q2-earnings-decline-y-y-despite-revenue-growth?cid=CS-BENZ-FT-444845,Zacks,,,,,,
2019-07-18T08:00:00.000+08:00,An Update on Wells Fargo,JPM,http://www.gurufocus.com/news/910662/an-update-on-wells-fargo,GuruFocus,,,,,,
2019-07-18T08:00:00.000+08:00,"JAGGAER Partners with J.P. Morgan to Provide Powerful Purchasing Oversight for Education, ...",JPM,http://www.gurufocus.com/news/911070/jaggaer-partners-with-jp-morgan-to-provide-powerful-purchasing-oversight-for-education-public-sector-and-commercial-industries,GuruFocus,,,,,,
2019-07-18T08:00:00.000+08:00,JPMorgan: Q2 Confirms 10% Annual Return; Reiterate Buy,JPM,https://seekingalpha.com/article/4275561-jpmorgan-q2-confirms-10-percent-annual-return-reiterate-buy?source=partner_benzinga,Seeking Alpha,,,,,,
2019-07-18T08:00:00.000+08:00,"We're With You, JPMorgan Chase",JPM,https://seekingalpha.com/article/4275648-jpmorgan-chase?source=partner_benzinga,Seeking Alpha,,,,,,
2019-07-18T08:00:00.000+08:00,"Net Interest Margins Are Declining, But Federal Reserve Comes To The Rescue",JPM,https://seekingalpha.com/article/4275638-net-interest-margins-declining-federal-reserve-comes-rescue?source=partner_benzinga,Seeking Alpha,,,,,,
2019-07-18T08:00:00.000+08:00,Just 'Okay' Is Still Pretty Good For JPMorgan,JPM,https://seekingalpha.com/article/4275619-just-okay-still-pretty-good-jpmorgan?source=partner_benzinga,Seeking Alpha,,,,,,
2019-07-19T08:00:00.000+08:00,"Craig Hemke: Silver To Continue Lagging Gold, Will Struggle To Overcome $17",JPM,https://www.benzinga.com/node/14106113,TalkMarkets,,,,,,
2019-07-19T08:00:00.000+08:00,"QV Investors Inc. Buys Johnson & Johnson, JPMorgan Chase, Liberty Broadband Corp, Sells ...",JPM,http://www.gurufocus.com/news/912231/qv-investors-inc-buys-johnson--johnson-jpmorgan-chase-liberty-broadband-corp-sells-varex-imaging-corp-autozone-inc-citigroup-inc,GuruFocus,,,,,,
2019-07-19T08:00:00.000+08:00,"Lynch & Associates Buys Dow Inc, JPMorgan Chase, Berkshire Hathaway Inc, Sells iShares ...",JPM,http://www.gurufocus.com/news/912079/lynch--associates-buys-dow-inc-jpmorgan-chase-berkshire-hathaway-inc-sells-ishares-russell-midcap-navidea-biopharmaceuticals-inc,GuruFocus,,,,,,
2019-07-19T08:00:00.000+08:00,"Bessemer Group Inc Buys Alibaba Group Holding, JPMorgan Chase, VanEck Vectors Gold Miners, ...",JPM,http://www.gurufocus.com/news/912072/bessemer-group-inc-buys-alibaba-group-holding-jpmorgan-chase-vaneck-vectors-gold-miners-sells-unitedhealth-group-inc-spdr-select-sector-fund--energy-select-sector-markel-corp,GuruFocus,,,,,,
2019-07-19T08:00:00.000+08:00,"Bristlecone Advisors, LLC Buys Alphabet Inc, Illumina Inc, Visa Inc, Sells Microsoft Corp, ...",JPM,http://www.gurufocus.com/news/912065/bristlecone-advisors-llc-buys-alphabet-inc-illumina-inc-visa-inc-sells-microsoft-corp-paccar-inc-everest-re-group,GuruFocus,,,,,,
2019-07-19T08:00:00.000+08:00,It's Harder To Defend Wells Fargo Absent Meaningful Progress,JPM,https://seekingalpha.com/article/4276048-harder-defend-wells-fargo-absent-meaningful-progress?source=partner_benzinga,Seeking Alpha,,,,,,
2019-07-19T08:00:00.000+08:00,JPMorgan Chase: Boring Is Good,JPM,https://seekingalpha.com/article/4276035-jpmorgan-chase-boring-good?source=partner_benzinga,Seeking Alpha,,,,,,
2019-07-19T08:00:00.000+08:00,Why JPMorgan Chase (JPM) is a Great Dividend Stock Right Now,JPM,http://www.zacks.com/stock/news/445360/why-jpmorgan-chase-jpm-is-a-great-dividend-stock-right-now?cid=CS-BENZ-FT-445360,Zacks,,,,,,
2019-07-19T08:00:00.000+08:00,"Dow 30 Stock Roundup: MSFT, JPM, IBM, JNJ, GS Earnings Impress",JPM,http://www.zacks.com/stock/news/445316/dow-30-stock-roundup-msft-jpm-ibm-jnj-gs-earnings-impress?cid=CS-BENZ-FT-445316,Zacks,,,,,,
2019-07-19T08:00:00.000+08:00,Financial ETFs Caught Between Solid Earnings & Falling Yields,JPM,http://www.zacks.com/stock/news/445287/financial-etfs-caught-between-solid-earnings-falling-yields?cid=CS-BENZ-FT-445287,Zacks,,,,,,
2019-07-19T08:00:00.000+08:00,Dow Dog Days Of Summer: Broker Targets Near As Prices Hit Historic Highs,JPM,https://seekingalpha.com/article/4275945-dow-dog-days-summer-broker-targets-near-prices-hit-historic-highs?source=partner_benzinga,Seeking Alpha,,,,,,
2019-07-21T08:00:00.000+08:00,International Dividend Portfolio: Income Update Q2 2019,JPM,https://seekingalpha.com/article/4276303-international-dividend-portfolio-income-update-q2-2019?source=partner_benzinga,Seeking Alpha,,,,,,
2019-07-21T08:00:00.000+08:00,Goldman Sachs - This Is A Business In Trouble,JPM,https://seekingalpha.com/article/4276298-goldman-sachs-business-trouble?source=partner_benzinga,Seeking Alpha,,,,,,
2019-07-21T08:00:00.000+08:00,AMTD International Begins U.S. IPO Effort,JPM,https://seekingalpha.com/article/4276269-amtd-international-begins-u-s-ipo-effort?source=partner_benzinga,Seeking Alpha,,,,,,
2019-07-22T08:00:00.000+08:00,"The Zacks Analyst Blog Highlights: Microsoft, JPMorgan, Merck, Johnson & Johnson and IBM",JPM,http://www.zacks.com/stock/news/446790/the-zacks-analyst-blog-highlights-microsoft-jpmorgan-merck-johnson-johnson-and-ibm?cid=CS-BENZ-FT-446790,Zacks,,,,,,
2019-07-22T08:00:00.000+08:00,With All Eyes On Earnings Watch These Two Stocks,JPM,https://www.benzinga.com/node/14107375,TalkMarkets,,,,,,
2019-07-23T08:00:00.000+08:00,"Coca-Cola, Financial Stocks Lead Dow Jones Today; Yeti, New Oriental Surge",JPM,http://www.investors.com/market-trend/stock-market-today/dow-jones-today-led-by-coca-cola-stock-jp-morgan-goldman-sachs/?src=A00237A&ven=BenzingaCP&src=AURLAAM,Investor's Business Daily,,,,,,
2019-07-23T08:00:00.000+08:00,"Ycg, Llc Buys Wells Fargo, Bank of America Corporation, JPMorgan Chase, Sells TD Ameritrade ...",JPM,http://www.gurufocus.com/news/913789/ycg-llc-buys-wells-fargo-bank-of-america-corporation-jpmorgan-chase-sells-td-ameritrade-holding-corp,GuruFocus,,,,,,
2019-07-23T08:00:00.000+08:00,Zelle Network Q2 transactions rise 56% Y/Y,JPM,https://seekingalpha.com/news/3480407-zelle-network-q2-transactions-rise-56-percent-y-y?source=partner_benzinga,Seeking Alpha,,,,,,
2019-07-23T08:00:00.000+08:00,Morgan Stanley: Brace For More Underperformance,JPM,https://seekingalpha.com/article/4276794-morgan-stanley-brace-underperformance?source=partner_benzinga,Seeking Alpha,,,,,,
2019-07-23T08:00:00.000+08:00,"Dow Jones, Small Caps Jump In Unison; These Growth Stocks Buck The Bears, Break Out",JPM,http://www.investors.com/market-trend/stock-market-today/dow-jones-small-caps-jump-in-unison-these-2-growth-stocks-buck-the-bears-break-out/?src=A00237A&ven=BenzingaCP&src=AURLAAM,Investor's Business Daily,,,,,,
2019-07-24T08:00:00.000+08:00,Q2 Earnings Season & the Trade Issue,JPM,http://www.zacks.com/commentary/448903/q2-earnings-season-the-trade-issue?cid=CS-BENZ-FT-earnings_outlook-448903,Zacks,,,,,,
2019-07-24T08:00:00.000+08:00,JP Morgan Creating A Very Bullish Pattern?,JPM,https://www.benzinga.com/node/14127499,TalkMarkets,,,,,,
2019-07-24T08:00:00.000+08:00,United Bancorp: The Small Banking Engine That You Never Heard Coming,JPM,https://seekingalpha.com/article/4277065-united-bancorp-small-banking-engine-never-heard-coming?source=partner_benzinga,Seeking Alpha,,,,,,
2019-07-24T08:00:00.000+08:00,"All Hail The Breakout Kings: Texas Instruments, Coca-Cola, Stanley Black, Snap, Goldman, Edwards Lifesciences, Delta Air Lines",JPM,https://seekingalpha.com/article/4277055-hail-breakout-kings-texas-instruments-coca-cola-stanley-black-snap-goldman-edwards?source=partner_benzinga,Seeking Alpha,,,,,,
2019-07-24T08:00:00.000+08:00,Big Banks' Q2 Earnings Synopsis: Near-Term View in the Balance,JPM,http://www.zacks.com/stock/news/448788/big-banks-q2-earnings-synopsis-near-term-view-in-the-balance?cid=CS-BENZ-FT-analyst_blog|industry_focus-448788,Zacks,,,,,,
2019-07-24T08:00:00.000+08:00,"The Zacks Analyst Blog Highlights: Microsoft, JPMorgan, Wells Fargo, American Express and Exxon Mobil",JPM,http://www.zacks.com/stock/news/448793/the-zacks-analyst-blog-highlights-microsoft-jpmorgan-wells-fargo-american-express-and-exxon-mobil?cid=CS-BENZ-FT-press_releases-448793,Zacks,,,,,,
2019-07-24T08:00:00.000+08:00,JPMorgan completes InstaMed purchase,JPM,https://seekingalpha.com/news/3480876-jpmorgan-completes-instamed-purchase?source=partner_benzinga,Seeking Alpha,,,,,,
2019-07-24T08:00:00.000+08:00,"Market Briefing For Wednesday, July 23",JPM,https://www.benzinga.com/node/14121865,TalkMarkets,,,,,,
2019-07-24T08:00:00.000+08:00,Wells Fargo Undervalued With A 15% Shareholder Yield,JPM,https://seekingalpha.com/article/4276912-wells-fargo-undervalued-15-percent-shareholder-yield?source=partner_benzinga,Seeking Alpha,,,,,,
2019-07-25T08:00:00.000+08:00,JPMorgan to lower advisory fees on 30 mutual funds,JPM,https://seekingalpha.com/news/3481863-jpmorgan-lower-advisory-fees-30-mutual-funds?source=partner_benzinga,Seeking Alpha,,,,,,
2019-07-25T08:00:00.000+08:00,"Mount Vernon Associates Inc Buys Apple Inc, Amazon. ...",JPM,http://www.gurufocus.com/news/915452/mount-vernon-associates-inc-buys-apple-inc-amazoncom-inc-microsoft-corp-sells-toll-brothers-inc-arconic-inc-wyndham-destinations-inc,GuruFocus,,,,,,
2019-07-25T08:00:00.000+08:00,"Royal Bank Of Scotland Group Plc Buys The Estee Lauder Inc, Danaos Corp, Apple Inc, Sells ...",JPM,http://www.gurufocus.com/news/915457/royal-bank-of-scotland-group-plc-buys-the-estee-lauder-inc-danaos-corp-apple-inc-sells-danaos-corp-southwest-airlines-co-vanguard-health-care,GuruFocus,,,,,,
2019-07-26T08:00:00.000+08:00,"Northpointe Capital Llc Buys Chevron Corp, Host Hotels & Resorts Inc, VICI Properties Inc, ...",JPM,http://www.gurufocus.com/news/916093/northpointe-capital-llc-buys-chevron-corp-host-hotels--resorts-inc-vici-properties-inc-sells-allergan-plc-cisco-systems-inc-omega-healthcare-investors-inc,GuruFocus,,,,,,
2019-07-26T08:00:00.000+08:00,"Wambolt & Associates, LLC Buys Prosperity Bancshares Inc, Fortune Brands Home & ...",JPM,http://www.gurufocus.com/news/916090/wambolt--associates-llc-buys-prosperity-bancshares-inc-fortune-brands-home--security-inc-sun-life-financial-inc-sells-xcel-energy-inc-berkshire-hathaway-inc-williams-inc,GuruFocus,,,,,,
2019-07-26T08:00:00.000+08:00,Should iShares Morningstar Large-Cap Value ETF (JKF) Be on Your Investing Radar?,JPM,http://www.zacks.com/stock/news/451203/should-ishares-morningstar-large-cap-value-etf-jkf-be-on-your-investing-radar?cid=CS-BENZ-FT-style_box_etf-451203,Zacks,,,,,,
2019-07-26T08:00:00.000+08:00,"Bank Stock Roundup: Q2 Earnings in Full Swing, Fifth Third Beats Estimates",JPM,http://www.zacks.com/stock/news/450966/bank-stock-roundup-q2-earnings-in-full-swing-fifth-third-beats-estimates?cid=CS-BENZ-FT-analyst_blog|stock_roundup-450966,Zacks,,,,,,
2019-07-26T08:00:00.000+08:00,Why Citigroup Is The Best Bank Stock To Buy,JPM,https://seekingalpha.com/article/4277939-citigroup-best-bank-stock-buy?source=partner_benzinga,Seeking Alpha,,,,,,
2019-07-28T08:00:00.000+08:00,JP Morgan Preparing An Upside Breakout In August 2019,JPM,https://www.benzinga.com/node/14147822,TalkMarkets,,,,,,
2019-07-29T08:00:00.000+08:00,Refinancing boosts share of mortgage originations,JPM,https://seekingalpha.com/news/3482965-refinancing-boosts-share-mortgage-originations?source=partner_benzinga,Seeking Alpha,,,,,,
2019-07-29T08:00:00.000+08:00,IPO Update: AMTD International Proposes U.S. IPO Terms,JPM,https://seekingalpha.com/article/4278740-ipo-update-amtd-international-proposes-u-s-ipo-terms?source=partner_benzinga,Seeking Alpha,,,,,,
2019-07-29T08:00:00.000+08:00,OnDeck sinks 22% after JPMorgan ends small business loan partnership,JPM,https://seekingalpha.com/news/3482769-ondeck-sinks-22-percent-jpmorgan-ends-small-business-loan-partnership?source=partner_benzinga,Seeking Alpha,,,,,,
2019-07-29T08:00:00.000+08:00,"Salient Trust Co Lta Buys Facebook Inc, Visa Inc, UnitedHealth Group Inc, Sells Procter & ...",JPM,http://www.gurufocus.com/news/917395/salient-trust-co-lta-buys-facebook-inc-visa-inc-unitedhealth-group-inc-sells-procter--gamble-co-johnson--johnson-eli-lilly-and-co,GuruFocus,,,,,,
2019-07-29T08:00:00.000+08:00,"Thomas Story & Son Llc Buys Fastenal Co, Caterpillar Inc, NextEra Energy Inc",JPM,http://www.gurufocus.com/news/917303/thomas-story--son-llc-buys-fastenal-co-caterpillar-inc-nextera-energy-inc,GuruFocus,,,,,,
2019-07-29T08:00:00.000+08:00,Citigroup's Michael Corbat Deserves More Time,JPM,https://seekingalpha.com/article/4278572-citigroups-michael-corbat-deserves-time?source=partner_benzinga,Seeking Alpha,,,,,,
2019-07-29T08:00:00.000+08:00,"Wall Street Breakfast: U.S., China Resume Trade Talks",JPM,https://seekingalpha.com/article/4278555-wall-street-breakfast-u-s-china-resume-trade-talks?source=partner_benzinga,Seeking Alpha,,,,,,
2019-07-29T08:00:00.000+08:00,Banks face U.K. class action over forex-rigging,JPM,https://seekingalpha.com/news/3482576-banks-face-u-k-class-action-forex-rigging?source=partner_benzinga,Seeking Alpha,,,,,,
2019-07-30T08:00:00.000+08:00,Discover: What Was Good Became Too Expensive,JPM,https://seekingalpha.com/article/4279240-discover-good-became-expensive?source=partner_benzinga,Seeking Alpha,,,,,,
2019-07-30T08:00:00.000+08:00,"Boston Family Office Llc Buys SS&C Technologies Holdings Inc, Adobe Inc, JPMorgan Chase, ...",JPM,http://www.gurufocus.com/news/918848/boston-family-office-llc-buys-ssc-technologies-holdings-inc-adobe-inc-jpmorgan-chase-sells-celgene-corp-air-lease-corp-state-street-corporation,GuruFocus,,,,,,
2019-07-30T08:00:00.000+08:00,Munger and Icahn Make Oil Investing 'Easy',JPM,http://www.gurufocus.com/news/918745/munger-and-icahn-make-oil-investing-easy,GuruFocus,,,,,,
2019-07-30T08:00:00.000+08:00,"\"Munger And Icahn Make Oil Investing \"\"Easy\"\"\"",JPM,https://www.benzinga.com/node/14163191,TalkMarkets,,,,,,
2019-07-30T08:00:00.000+08:00,The Retiree's Dividend Portfolio - John's June Update: Why We Dropped Boeing,JPM,https://seekingalpha.com/article/4279120-retirees-dividend-portfolio-johns-june-update-dropped-boeing?source=partner_benzinga,Seeking Alpha,,,,,,
2019-07-30T08:00:00.000+08:00,JPMorgan turns to AI for writing,JPM,https://seekingalpha.com/news/3483555-jpmorgan-turns-ai-writing?source=partner_benzinga,Seeking Alpha,,,,,,
2019-07-30T08:00:00.000+08:00,JPMorgan takes on world's largest bank with entry into China,JPM,https://seekingalpha.com/news/3483507-jpmorgan-takes-worlds-largest-bank-entry-china?source=partner_benzinga,Seeking Alpha,,,,,,
2019-07-31T08:00:00.000+08:00,Making Sense of Q2 Earnings Results,JPM,http://www.zacks.com/commentary/455325/making-sense-of-q2-earnings-results?cid=CS-BENZ-FT-earnings_trends-455325,Zacks,,,,,,
2019-07-31T08:00:00.000+08:00,Making Sense of Q2 Earnings Results,JPM,http://www.zacks.com/commentary/455332/making-sense-of-q2-earnings-results?cid=CS-BENZ-FT-earnings_outlook-455332,Zacks,,,,,,
2019-07-31T08:00:00.000+08:00,"Apple Breaks Out Again, Dow Jones Reverses Lower; This Social Media Stock Crosses New Buy Point",JPM,http://www.investors.com/market-trend/stock-market-today/apple-breaks-out-again-leads-dow-jones-up-this-social-media-stock-crosses-new-buy-point/?src=A00237A&ven=BenzingaCP&src=AURLAAM,Investor's Business Daily,,,,,,
2019-07-31T08:00:00.000+08:00,Financials (Top 30 Weights) Earnings Estimates/Revisions,JPM,https://www.benzinga.com/node/14171459,TalkMarkets,,,,,,
2019-08-01T08:00:00.000+08:00,Guess Which Stocks Warren Buffett Bought: —nd-Quarter Contest,JPM,http://www.gurufocus.com/news/920437/guess-which-stocks-warren-buffett-bought-2ndquarter-contest,GuruFocus,,,,,,
2019-08-01T08:00:00.000+08:00,US Indexes Close Lower Thursday With China Tariff Announcement,JPM,http://www.gurufocus.com/news/920442/us-indexes-close-lower-thursday-with-china-tariff-announcement,GuruFocus,,,,,,
2019-08-01T08:00:00.000+08:00,"Eukles Asset Management Buys Illumina Inc, PayPal Holdings Inc, iShares Core –-5 Year USD ...",JPM,http://www.gurufocus.com/news/920432/eukles-asset-management-buys-illumina-inc-paypal-holdings-inc-ishares-core-15-year-usd-bond-etf-sells-waters-corp-eaton-vance-corp-firstcash-inc,GuruFocus,,,,,,
2019-08-01T08:00:00.000+08:00,"SPC Financial, Inc. Buys Invesco S&P 5…… Pure Growth, Texas Instruments Inc, JPMorgan ...",JPM,http://www.gurufocus.com/news/920428/spc-financial-inc-buys-invesco-sp-500-pure-growth-texas-instruments-inc-jpmorgan-chase-sells-phillips-66-bbt-corp-first-trust-health-care-alphadex,GuruFocus,,,,,,
2019-08-01T08:00:00.000+08:00,"Zacks Earnings Trends Highlights: Caterpillar, JPMorgan and CSX",JPM,http://www.zacks.com/stock/news/455903/zacks-earnings-trends-highlights-caterpillar-jpmorgan-and-csx?cid=CS-BENZ-FT-press_releases-455903,Zacks,,,,,,
2019-08-01T08:00:00.000+08:00,Fed Cuts Rates: Are Bank Stocks Still Worth Betting on?,JPM,http://www.zacks.com/stock/news/455897/fed-cuts-rates-are-bank-stocks-still-worth-betting-on?cid=CS-BENZ-FT-analyst_blog|industry_focus-455897,Zacks,,,,,,
2019-08-02T08:00:00.000+08:00,"CB&T Wealth Management Buys Northrop Grumman Corp, Waste Management Inc, Caterpillar Inc, ...",JPM,http://www.gurufocus.com/news/921218/cbt-wealth-management-buys-northrop-grumman-corp-waste-management-inc-caterpillar-inc-sells-corenergy-infrastructure-trust-inc-landmark-infrastructure-partners-lp-vanguard-value-etf,GuruFocus,,,,,,
2019-08-02T08:00:00.000+08:00,"JMG Financial Group, Ltd. Buys Schwab U.S. Large-Cap ETF, Amazon. ...",JPM,http://www.gurufocus.com/news/921245/jmg-financial-group-ltd-buys-schwab-us-largecap-etf-amazoncom-inc-jpmorgan-chase-sells-schwab-shortterm-us-treasury-etf-ishares-edge-msci-min-volatility-global-etf,GuruFocus,,,,,,
2019-08-02T08:00:00.000+08:00,"Cpcm, Llc Buys JPMorgan Ultra-Short Income ETF, Gilead Sciences Inc, iShares Edge MSCI Min ...",JPM,http://www.gurufocus.com/news/921248/cpcm-llc-buys-jpmorgan-ultrashort-income-etf-gilead-sciences-inc-ishares-edge-msci-min-volatility-usa-etf-sells-marchex-inc-bbt-corp-oneok-inc,GuruFocus,,,,,,
2019-08-02T08:00:00.000+08:00,The Puzzle Pieces Finally Come Together,JPM,https://seekingalpha.com/article/4281031-puzzle-pieces-finally-come-together?source=partner_benzinga,Seeking Alpha,,,,,,
2019-08-02T08:00:00.000+08:00,JPMorgan to redeem $880M of preferred stock,JPM,https://seekingalpha.com/news/3486494-jpmorgan-redeem-880m-preferred-stock?source=partner_benzinga,Seeking Alpha,,,,,,
2019-08-02T08:00:00.000+08:00,JPMorgan set for majority stake in China funds JV - Reuters,JPM,https://seekingalpha.com/news/3486455-jpmorgan-set-majority-stake-china-funds-jv-reuters?source=partner_benzinga,Seeking Alpha,,,,,,
2019-08-02T08:00:00.000+08:00,"Fed Cut Clouds Banks' Earnings Outlook, Are Lenders Worried? (Revised)",JPM,http://www.zacks.com/stock/news/457478/fed-cut-clouds-banks-earnings-outlook-are-lenders-worried-revised?cid=CS-BENZ-FT-analyst_blog|industry_focus-457478,Zacks,,,,,,
2019-08-02T08:00:00.000+08:00,"Occidental Asset Management, LLC Buys SPDR Barclays Intermediate Term Corporate Bond ETF, ...",JPM,http://www.gurufocus.com/news/920766/occidental-asset-management-llc-buys-spdr-barclays-intermediate-term-corporate-bond-etf-ishares-jp-morgan-usd-emerging-markets-bond-etf-ishares-05-year-high-yield-corporate-bond-etf-sells-spdr-barclays-13-month-tbill-e,GuruFocus,,,,,,
2019-08-03T08:00:00.000+08:00,Stocks To Watch: Trading Tariff Turbulence,JPM,https://seekingalpha.com/article/4281172-stocks-watch-trading-tariff-turbulence?source=partner_benzinga,Seeking Alpha,,,,,,
2019-08-04T08:00:00.000+08:00,Trading Tariff Turbulence (Stocks To Watch Podcast),JPM,https://seekingalpha.com/article/4281341-trading-tariff-turbulence-stocks-watch-podcast?source=partner_benzinga,Seeking Alpha,,,,,,
2019-08-05T08:00:00.000+08:00,Around The World - A Universal Manufacturing Collapse,JPM,https://seekingalpha.com/article/4281826-around-world-universal-manufacturing-collapse?source=partner_benzinga,Seeking Alpha,,,,,,
2019-08-05T08:00:00.000+08:00,Buy Square (SQ) Stock After Selloff on Broader Fintech & Cashless Growth?,JPM,http://www.zacks.com/stock/news/459380/buy-square-sq-stock-after-selloff-on-broader-fintech-cashless-growth?cid=CS-BENZ-FT-stocks_in_the_news|investment_ideas-459380,Zacks,,,,,,
2019-08-05T08:00:00.000+08:00,Financial stocks slide as traders bet on more Fed rate cuts,JPM,https://seekingalpha.com/news/3486835-financial-stocks-slide-traders-bet-fed-rate-cuts?source=partner_benzinga,Seeking Alpha,,,,,,
2019-08-05T08:00:00.000+08:00,Tracking Ken Fisher's Fisher Asset Management Portfolio - Q2 2019 Update,JPM,https://seekingalpha.com/article/4281629-tracking-ken-fishers-fisher-asset-management-portfolio-q2-2019-update?source=partner_benzinga,Seeking Alpha,,,,,,
