Date,Article_title,Stock_symbol,Url,Publisher,Author,Article,Lsa_summary,Luhn_summary,Textrank_summary,Lexrank_summary
2018-09-15T08:00:00.000+08:00,Stocks To Watch: Oracle Looks To Lift Tech Sector,JPM,https://seekingalpha.com/article/4206464-stocks-watch-oracle-looks-lift-tech-sector?source=partner_benzinga,Seeking Alpha,,,,,,
2018-09-17T08:00:00.000+08:00,"\"Banks need to \"\"disrupt themselves\"\" before someone else does: Morgan Stanley\"",JPM,https://seekingalpha.com/news/3390923-banks-need-disrupt-someone-else-morgan-stanley?source=partner_benzinga,Seeking Alpha,,,,,,
2018-09-17T08:00:00.000+08:00,Morgan Stanley's China M&A Move,JPM,https://seekingalpha.com/article/4206764-morgan-stanleys-china-m-move?source=partner_benzinga,Seeking Alpha,,,,,,
2018-09-17T08:00:00.000+08:00,The Great Divergence: It Won't Last Much Longer.,JPM,https://seekingalpha.com/article/4206740-great-divergence-last-much-longer?source=partner_benzinga,Seeking Alpha,,,,,,
2018-09-17T08:00:00.000+08:00,9/15/2018: 10th Anniversary Of The Lehman Bankruptcy,JPM,https://seekingalpha.com/article/4206690-9-15-2018-10th-anniversary-lehman-bankruptcy?source=partner_benzinga,Seeking Alpha,,,,,,
2018-09-17T08:00:00.000+08:00,JPMorgan pulls ahead of Fidelity in Europe ETF race: Financial News,JPM,https://seekingalpha.com/news/3390785-jpmorgan-pulls-ahead-fidelity-europe-etf-race-financial-news?source=partner_benzinga,Seeking Alpha,,,,,,
2018-09-17T08:00:00.000+08:00,Wells Fargo Faces New Challenge as Business Loans Decline,JPM,http://www.zacks.com/stock/news/323348/wells-fargo-faces-new-challenge-as-business-loans-decline?cid=CS-BENZ-FT-323348,Zacks,,,,,,
2018-09-17T08:00:00.000+08:00,"The Zacks Analyst Blog Highlights: JPMorgan, Mastercard, AbbVie, CVS Health and Estee Lauder",JPM,http://www.zacks.com/stock/news/323270/the-zacks-analyst-blog-highlights-jpmorgan-mastercard-abbvie-cvs-health-and-estee-lauder?cid=CS-BENZ-FT-323270,Zacks,,,,,,
2018-09-17T08:00:00.000+08:00,Deutsche (DB) to Shift Large Portion of Assets From London,JPM,http://www.zacks.com/stock/news/323231/deutsche-db-to-shift-large-portion-of-assets-from-london?cid=CS-BENZ-FT-323231,Zacks,,,,,,
2018-09-18T08:00:00.000+08:00,JPMorgan Chase declares $0.80 dividend,JPM,https://seekingalpha.com/news/3391260-jpmorgan-chase-declares-0_80-dividend?source=partner_benzinga,Seeking Alpha,,,,,,
2018-09-18T08:00:00.000+08:00,Why Did Amazon (AMZN) Stock Climb Today?,JPM,http://www.zacks.com/stock/news/323663/why-did-amazon-amzn-stock-climb-today?cid=CS-BENZ-FT-323663,Zacks,,,,,,
2018-09-18T08:00:00.000+08:00,JPMorgan - 5.75% Forever,JPM,https://seekingalpha.com/article/4206894-jpmorgan-5_75-percent-forever?source=partner_benzinga,Seeking Alpha,,,,,,
2018-09-18T08:00:00.000+08:00,TCA by E*Trade continues expanding ETF trading platform,JPM,https://seekingalpha.com/news/3391076-tca-e-trade-continues-expanding-etf-trading-platform?source=partner_benzinga,Seeking Alpha,,,,,,
2018-09-19T08:00:00.000+08:00,"Dow Jones Closes at —6,4…5.76 on Wednesday",JPM,http://www.gurufocus.com/news/742125/dow-jones-closes-at-2640576-on-wednesday,GuruFocus,,,,,,
2018-09-19T08:00:00.000+08:00,"Blue Chips Rise; JPMorgan, Goldman Lead Dow; Oil Stocks Strong Again",JPM,http://www.investors.com/market-trend/stock-market-today/blue-chips-jp-morgan-goldman-sachs-lead-dow/?src=A00237A&ven=BenzingaCP&src=AURLAAM,Investor's Business Daily,,,,,,
2018-09-19T08:00:00.000+08:00,This Is What Disruption Looks Like: The Coming Shakeout In Transaction Banking,JPM,https://seekingalpha.com/article/4207197-disruption-looks-like-coming-shakeout-transaction-banking?source=partner_benzinga,Seeking Alpha,,,,,,
2018-09-19T08:00:00.000+08:00,Tesla Bull Sells (and Buys Again?) & Dow Rallies Near Highs | Free Lunch,JPM,http://www.zacks.com/stock/news/323915/tesla-bull-sells-and-buys-again-dow-rallies-near-highs-free-lunch?cid=CS-BENZ-FT-323915,Zacks,,,,,,
2018-09-19T08:00:00.000+08:00,Financial stocks climb as 10-year yield breaches 3%,JPM,https://seekingalpha.com/news/3391511-financial-stocks-climb-10-year-yield-breaches-3-percent?source=partner_benzinga,Seeking Alpha,,,,,,
2018-09-19T08:00:00.000+08:00,"Goldman +2.4% as new investment co-chief picked, investing app developments",JPM,https://seekingalpha.com/news/3391490-goldman-plus-2_4-percent-new-investment-co-chief-picked-investing-app-developments?source=partner_benzinga,Seeking Alpha,,,,,,
2018-09-19T08:00:00.000+08:00,Should WisdomTree U.S. Earnings 500 Fund (EPS) Be on Your Investing Radar?,JPM,http://www.zacks.com/stock/news/323787/should-wisdomtree-us-earnings-500-fund-eps-be-on-your-investing-radar?cid=CS-BENZ-FT-323787,Zacks,,,,,,
2018-09-19T08:00:00.000+08:00,BofA to Divest Alternative Investment Feeder Funds Business,JPM,http://www.zacks.com/stock/news/323748/bofa-to-divest-alternative-investment-feeder-funds-business?cid=CS-BENZ-FT-323748,Zacks,,,,,,
2018-09-20T08:00:00.000+08:00,"Paragon Associates & Paragon Associates Ii Joint V Buys Exxon Mobil Corp, Goldman Sachs ...",JPM,http://www.gurufocus.com/news/742746/paragon-associates--paragon-associates-ii-joint-v-buys-exxon-mobil-corp-goldman-sachs-group-inc-dhi-group-inc-sells-occidental-petroleum-corp-citigroup-inc-jpmorgan-chase,GuruFocus,,,,,,
2018-09-20T08:00:00.000+08:00,"Blue Chips, Techs, China Stocks Power Market Higher; IPO Eventbrite Soars",JPM,http://www.investors.com/market-trend/stock-market-today/dow-stocks-tech-stocks-lead-stock-market-rally/?src=A00237A&ven=BenzingaCP&src=AURLAAM,Investor's Business Daily,,,,,,
2018-09-20T08:00:00.000+08:00,These 5 Bank Stocks Are Near Buy Points: Investing Action Plan,JPM,http://www.investors.com/research/investing-action-plan/bank-stocks-jpmorgan-bank-of-america-buy-points/?src=A00237A&ven=BenzingaCP&src=AURLAAM,Investor's Business Daily,,,,,,
2018-09-20T08:00:00.000+08:00,"Apple, Techs, Banks Rise; Tilray Stock Shows Signs Of A Near-Term Market Top",JPM,http://www.investors.com/market-trend/stock-market-today/apple-techs-banks-rise-tilray-stock-shows-signs-of-a-near-term-market-top/?src=A00237A&ven=BenzingaCP&src=AURLAAM,Investor's Business Daily,,,,,,
2018-09-20T08:00:00.000+08:00,Bank Of America: Dividend Growth And Share Buybacks Make This Stock A Buy,JPM,https://seekingalpha.com/article/4207354-bank-america-dividend-growth-share-buybacks-make-stock-buy?source=partner_benzinga,Seeking Alpha,,,,,,
2018-09-20T08:00:00.000+08:00,"Stock Market News For Sep 20, 2018",JPM,http://www.zacks.com/stock/news/324069/stock-market-news-for-sep-20-2018?cid=CS-BENZ-FT-324069,Zacks,,,,,,
2018-09-20T08:00:00.000+08:00,"History In The Making: Hope For The Best, Prepare For The Worst",JPM,https://seekingalpha.com/article/4207335-history-making-hope-best-prepare-worst?source=partner_benzinga,Seeking Alpha,,,,,,
2018-09-20T08:00:00.000+08:00,Is Goldman Sachs Mulling the Spin-Off of Fintech App Simon?,JPM,http://www.zacks.com/stock/news/324066/is-goldman-sachs-mulling-the-spin-off-of-fintech-app-simon?cid=CS-BENZ-FT-324066,Zacks,,,,,,
2018-09-20T08:00:00.000+08:00,Why Buy Bank Of America When You Could Buy JPMorgan?,JPM,https://seekingalpha.com/article/4207304-buy-bank-america-buy-jpmorgan?source=partner_benzinga,Seeking Alpha,,,,,,
2018-09-20T08:00:00.000+08:00,Sky Takeover Settled By Rare Auction (Wall Street Breakfast Podcast),JPM,https://seekingalpha.com/article/4207307-sky-takeover-settled-rare-auction-wall-street-breakfast-podcast?source=partner_benzinga,Seeking Alpha,,,,,,
2018-09-20T08:00:00.000+08:00,Wall Street Breakfast: Sky Takeover Settled By Rare Auction,JPM,https://seekingalpha.com/article/4207287-wall-street-breakfast-sky-takeover-settled-rare-auction?source=partner_benzinga,Seeking Alpha,,,,,,
2018-09-20T08:00:00.000+08:00,Biggest risks to the financial system?,JPM,https://seekingalpha.com/news/3391643-biggest-risks-financial-system?source=partner_benzinga,Seeking Alpha,,,,,,
2018-09-21T08:00:00.000+08:00,Let's Talk About General Electric's Downgrade,JPM,https://seekingalpha.com/article/4207598-talk-general-electrics-downgrade?source=partner_benzinga,Seeking Alpha,,,,,,
2018-09-21T08:00:00.000+08:00,"Bank Stock Roundup: Economic Growth Inspires Optimism, WFC & BofA in Focus",JPM,http://www.zacks.com/stock/news/324327/bank-stock-roundup-economic-growth-inspires-optimism-wfc-bofa-in-focus?cid=CS-BENZ-FT-324327,Zacks,,,,,,
2018-09-21T08:00:00.000+08:00,The Market Rally Is Sustainable - Cramer's Mad Money (9/20/18),JPM,https://seekingalpha.com/article/4207549-market-rally-sustainable-cramers-mad-money-9-20-18?source=partner_benzinga,Seeking Alpha,,,,,,
2018-09-21T08:00:00.000+08:00,"Dow 30 Stock Roundup: JPMorgan Ups Dividend, Disney's ESPN+ Hits 1M Paid Subscribers",JPM,http://www.zacks.com/stock/news/324194/dow-30-stock-roundup-jpmorgan-ups-dividend-disneys-espn%2B-hits-1m-paid-subscribers?cid=CS-BENZ-FT-324194,Zacks,,,,,,
2018-09-23T08:00:00.000+08:00,Breakout Alert: Buy Bank Stocks,JPM,https://seekingalpha.com/article/4207792-breakout-alert-buy-bank-stocks?source=partner_benzinga,Seeking Alpha,,,,,,
2018-09-23T08:00:00.000+08:00,"The Top 20 S&P 500 Companies From 2008 Didn't Need Any Babysitting, At All",JPM,https://seekingalpha.com/article/4207762-top-20-s-and-p-500-companies-2008-need-babysitting?source=partner_benzinga,Seeking Alpha,,,,,,
2018-09-23T08:00:00.000+08:00,The Dogs Of The Dow September Update By Dividend Dogcatcher,JPM,https://seekingalpha.com/article/4207757-dogs-dow-september-update-dividend-dogcatcher?source=partner_benzinga,Seeking Alpha,,,,,,
2018-09-23T08:00:00.000+08:00,My Current View On Long-Term Bank Investing,JPM,https://seekingalpha.com/article/4207754-current-view-long-term-bank-investing?source=partner_benzinga,Seeking Alpha,,,,,,
2018-09-23T08:00:00.000+08:00,Is The Great Rotation Into Equities After A 37-Year Run In Bonds Finally Upon Us?,JPM,https://seekingalpha.com/article/4207748-great-rotation-equities-37-year-run-bonds-finally-upon-us?source=partner_benzinga,Seeking Alpha,,,,,,
2018-09-23T08:00:00.000+08:00,"7 Dividend Increases: September 17-21, 2018",JPM,https://seekingalpha.com/article/4207721-7-dividend-increases-september-17minus-21-2018?source=partner_benzinga,Seeking Alpha,,,,,,
2018-09-24T08:00:00.000+08:00,SPY: Will Bears Get Slaughtered?,JPM,https://seekingalpha.com/article/4208027-spy-will-bears-get-slaughtered?source=partner_benzinga,Seeking Alpha,,,,,,
2018-09-24T08:00:00.000+08:00,Dow Jones Futures: So Much For The Stock Market Rotation Out Of Big Techs,JPM,http://www.investors.com/market-trend/stock-market-today/dow-jones-futures-so-much-for-the-stock-market-rotation-out-of-big-techs/?src=A00237A&ven=BenzingaCP&src=AURLAAM,Investor's Business Daily,,,,,,
2018-09-24T08:00:00.000+08:00,Dimon: Growing business better idea than buybacks,JPM,https://seekingalpha.com/news/3392537-dimon-growing-business-better-idea-buybacks?source=partner_benzinga,Seeking Alpha,,,,,,
2018-09-24T08:00:00.000+08:00,Why Bank Of America Shares Dropped And Then Popped - Future Implications,JPM,https://seekingalpha.com/article/4207989-bank-america-shares-dropped-popped-future-implications?source=partner_benzinga,Seeking Alpha,,,,,,
2018-09-24T08:00:00.000+08:00,The Challenges Facing Goldman's New CEO,JPM,https://seekingalpha.com/article/4207931-challenges-facing-goldmans-new-ceo?source=partner_benzinga,Seeking Alpha,,,,,,
2018-09-24T08:00:00.000+08:00,"'Safer' Dividend Dow Dogs: Intel, Chevron, DowDupont, McDonald's, And Boeing Cast Biggest Gains Per Broker September Targets",JPM,https://seekingalpha.com/article/4207879-safer-dividend-dow-dogs-intel-chevron-dowdupont-mcdonalds-boeing-cast-biggest-gains-per?source=partner_benzinga,Seeking Alpha,,,,,,
2018-09-24T08:00:00.000+08:00,Charts Of The Day: Perspectives,JPM,https://seekingalpha.com/article/4207874-charts-day-perspectives?source=partner_benzinga,Seeking Alpha,,,,,,
2018-09-24T08:00:00.000+08:00,Is It Time To Bail Out On Wells Fargo?,JPM,https://seekingalpha.com/article/4207625-time-bail-wells-fargo?source=partner_benzinga,Seeking Alpha,,,,,,
2018-09-24T08:00:00.000+08:00,"OPEC, Russia Reject Trump Demand for Output Boost: 5 Picks",JPM,http://www.zacks.com/stock/news/324436/opec-russia-reject-trump-demand-for-output-boost-5-picks?cid=CS-BENZ-FT-324436,Zacks,,,,,,
2018-09-24T08:00:00.000+08:00,"JPMorgan Chase expands in Philadelphia, Delaware Valley region",JPM,https://seekingalpha.com/news/3392357-jpmorgan-chase-expands-philadelphia-delaware-valley-region?source=partner_benzinga,Seeking Alpha,,,,,,
2018-09-24T08:00:00.000+08:00,Latest U.S.-China Tariffs Take Effect (Wall Street Breakfast Podcast),JPM,https://seekingalpha.com/article/4207842-latest-u-s-china-tariffs-take-effect-wall-street-breakfast-podcast?source=partner_benzinga,Seeking Alpha,,,,,,
2018-09-24T08:00:00.000+08:00,Walking Towards And/Or Blindly Falling Off The Cliff,JPM,https://seekingalpha.com/article/4207840-walking-towards-blindly-falling-cliff?source=partner_benzinga,Seeking Alpha,,,,,,
2018-09-24T08:00:00.000+08:00,Game Plan For The Week - Cramer's Mad Money (9/21/18),JPM,https://seekingalpha.com/article/4207838-game-plan-week-cramers-mad-money-9-21-18?source=partner_benzinga,Seeking Alpha,,,,,,
2018-09-24T08:00:00.000+08:00,Wall Street Breakfast: Latest U.S.-China Tariffs Take Effect,JPM,https://seekingalpha.com/article/4207825-wall-street-breakfast-latest-u-s-china-tariffs-take-effect?source=partner_benzinga,Seeking Alpha,,,,,,
2018-09-24T08:00:00.000+08:00,"Trade war dimming prospects for large scale M&A, J.P. Morgan banker says",JPM,https://seekingalpha.com/news/3392295-trade-war-dimming-prospects-large-scale-m-j-p-morgan-banker-says?source=partner_benzinga,Seeking Alpha,,,,,,
2018-09-25T08:00:00.000+08:00,Interactive Brokers - U.S. Fixed Income Calendar: The Week Ahead,JPM,https://seekingalpha.com/article/4208108-interactive-brokers-u-s-fixed-income-calendar-week-ahead?source=partner_benzinga,Seeking Alpha,,,,,,
2018-09-25T08:00:00.000+08:00,Down With The Dow,JPM,https://seekingalpha.com/article/4208104-dow?source=partner_benzinga,Seeking Alpha,,,,,,
2018-09-25T08:00:00.000+08:00,Investors Are Thinking Short Term - Cramer's Mad Money (9/24/18),JPM,https://seekingalpha.com/article/4208082-investors-thinking-short-term-cramers-mad-money-9-24-18?source=partner_benzinga,Seeking Alpha,,,,,,
2018-09-26T08:00:00.000+08:00,Looking Ahead to the Q3 Earnings Season,JPM,http://www.zacks.com/commentary/183798/looking-ahead-to-the-q3-earnings-season?cid=CS-BENZ-FT-183798,Zacks,,,,,,
2018-09-26T08:00:00.000+08:00,Looking Ahead to the Q3 Earnings Season,JPM,http://www.zacks.com/commentary/183797/looking-ahead-to-the-q3-earnings-season?cid=CS-BENZ-FT-183797,Zacks,,,,,,
2018-09-26T08:00:00.000+08:00,"Credit Suisse, JPMorgan vie to lead Lyft IPO: Financial Times",JPM,https://seekingalpha.com/news/3393209-credit-suisse-jpmorgan-vie-lead-lyft-ipo-financial-times?source=partner_benzinga,Seeking Alpha,,,,,,
2018-09-26T08:00:00.000+08:00,JPMorgan to Open Additional Branches in Florida & Georgia,JPM,http://www.zacks.com/stock/news/324840/jpmorgan-to-open-additional-branches-in-florida-georgia?cid=CS-BENZ-FT-324840,Zacks,,,,,,
2018-09-27T08:00:00.000+08:00,Royal Bank Of Canada: Time To Buy?,JPM,https://seekingalpha.com/article/4208728-royal-bank-canada-time-buy?source=partner_benzinga,Seeking Alpha,,,,,,
2018-09-27T08:00:00.000+08:00,"JPMorgan, Goldman working on Perella Weinberg IPO: Bloomberg",JPM,https://seekingalpha.com/news/3393553-jpmorgan-goldman-working-perella-weinberg-ipo-bloomberg?source=partner_benzinga,Seeking Alpha,,,,,,
2018-09-27T08:00:00.000+08:00,JPMorgan considers blending different kinds of debt in EM bond indexes,JPM,https://seekingalpha.com/news/3393546-jpmorgan-considers-blending-different-kinds-debt-em-bond-indexes?source=partner_benzinga,Seeking Alpha,,,,,,
2018-09-27T08:00:00.000+08:00,"Into Weakness, Citigroup Prepares To Report Earnings",JPM,https://seekingalpha.com/article/4208592-weakness-citigroup-prepares-report-earnings?source=partner_benzinga,Seeking Alpha,,,,,,
2018-09-27T08:00:00.000+08:00,Best And Worst-Performing Stocks In The S&P 500 Over The Last 20 Years And How They Have Performed In 2018,JPM,https://seekingalpha.com/article/4208570-best-worst-performing-stocks-s-and-p-500-last-20-years-performed-2018?source=partner_benzinga,Seeking Alpha,,,,,,
2018-09-27T08:00:00.000+08:00,Chase adds feature to lock/unlock credit cards,JPM,https://seekingalpha.com/news/3393414-chase-adds-feature-lock-unlock-credit-cards?source=partner_benzinga,Seeking Alpha,,,,,,
2018-09-27T08:00:00.000+08:00,Fed Announces 2018's Third Rate Hike: 5 Bank Picks,JPM,http://www.zacks.com/stock/news/325117/fed-announces-2018s-third-rate-hike-5-bank-picks?cid=CS-BENZ-FT-325117,Zacks,,,,,,
2018-09-27T08:00:00.000+08:00,U.S. Bancorp to Vend ATM & Debit Servicing Business to Fiserv,JPM,http://www.zacks.com/stock/news/325094/us-bancorp-to-vend-atm-debit-servicing-business-to-fiserv?cid=CS-BENZ-FT-325094,Zacks,,,,,,
2018-09-27T08:00:00.000+08:00,JPMorgan: Industry Dominance Is Their Recipe For Success,JPM,https://seekingalpha.com/article/4208542-jpmorgan-industry-dominance-recipe-success?source=partner_benzinga,Seeking Alpha,,,,,,
2018-09-28T08:00:00.000+08:00,Citigroup: Case For Big Gains,JPM,https://seekingalpha.com/article/4208951-citigroup-case-big-gains?source=partner_benzinga,Seeking Alpha,,,,,,
2018-09-28T08:00:00.000+08:00,Would Tesla be Better Off with a New CEO?,JPM,http://www.zacks.com/commentary/184115/would-tesla-be-better-off-with-a-new-ceo?cid=CS-BENZ-FT-184115,Zacks,,,,,,
2018-09-28T08:00:00.000+08:00,Has the Earnings Picture Started Weakening?,JPM,http://www.zacks.com/commentary/184111/has-the-earnings-picture-started-weakening?cid=CS-BENZ-FT-184111,Zacks,,,,,,
2018-09-28T08:00:00.000+08:00,JPMorgan: Setting Up For New Highs,JPM,https://seekingalpha.com/article/4208927-jpmorgan-setting-new-highs?source=partner_benzinga,Seeking Alpha,,,,,,
2018-09-28T08:00:00.000+08:00,"Goldman, JPMorgan among banks facing stock-lending antitrust case: Reuters",JPM,https://seekingalpha.com/news/3393793-goldman-jpmorgan-among-banks-facing-stock-lending-antitrust-case-reuters?source=partner_benzinga,Seeking Alpha,,,,,,
2018-09-28T08:00:00.000+08:00,Is Chesapeake Energy Really Paying Over 7% To Borrow $1.25B?,JPM,https://seekingalpha.com/article/4208886-chesapeake-energy-really-paying-7-percent-borrow-1_25b?source=partner_benzinga,Seeking Alpha,,,,,,
2018-09-28T08:00:00.000+08:00,Accumulating High Quality Dividend Champ Texas Bank Reasonably Priced With Insider Buying,JPM,https://seekingalpha.com/article/4208847-accumulating-high-quality-dividend-champ-texas-bank-reasonably-priced-insider-buying?source=partner_benzinga,Seeking Alpha,,,,,,
2018-09-28T08:00:00.000+08:00,Antitrust Lawsuit Against Big Wall Street Banks Gets Approval,JPM,http://www.zacks.com/stock/news/325339/antitrust-lawsuit-against-big-wall-street-banks-gets-approval?cid=CS-BENZ-FT-325339,Zacks,,,,,,
2018-09-28T08:00:00.000+08:00,5 Top Stocks to Buy Ahead of the Fourth Quarter,JPM,http://www.zacks.com/stock/news/325327/5-top-stocks-to-buy-ahead-of-the-fourth-quarter?cid=CS-BENZ-FT-325327,Zacks,,,,,,
2018-09-28T08:00:00.000+08:00,"3 Upcoming Dividend Increases, Including A 42% Raise",JPM,https://seekingalpha.com/article/4208783-3-upcoming-dividend-increases-including-42-percent-raise?source=partner_benzinga,Seeking Alpha,,,,,,
2018-09-30T08:00:00.000+08:00,"A Week of Yields: JPMorgan, American Express",JPM,http://www.gurufocus.com/news/746484/a-week-of-yields-jpmorgan-american-express,GuruFocus,,,,,,
2018-10-01T08:00:00.000+08:00,Banks climb after Goldman analyst sees promising Q3 reports ahead,JPM,https://seekingalpha.com/news/3394115-banks-climb-goldman-analyst-sees-promising-q3-reports-ahead?source=partner_benzinga,Seeking Alpha,,,,,,
2018-10-01T08:00:00.000+08:00,"JPMorgan, Pepsi, Lennar, Costco and Constellation Brands are part of Zacks Earnings Preview",JPM,http://www.zacks.com/stock/news/325566/jpmorgan-pepsi-lennar-costco-and-constellation-brands-are-part-of-zacks-earnings-preview?cid=CS-BENZ-FT-325566,Zacks,,,,,,
2018-10-01T08:00:00.000+08:00,Expected Dividend Increases In October 2018,JPM,https://seekingalpha.com/article/4209101-expected-dividend-increases-october-2018?source=partner_benzinga,Seeking Alpha,,,,,,
2018-10-02T08:00:00.000+08:00,JPMorgan Chase: A New Preferred Stock With An Old Symbol,JPM,https://seekingalpha.com/article/4209420-jpmorgan-chase-new-preferred-stock-old-symbol?source=partner_benzinga,Seeking Alpha,,,,,,
2018-10-02T08:00:00.000+08:00,Time to Buy Square (SQ) As Stock Jumps Again?,JPM,http://www.zacks.com/stock/news/325896/time-to-buy-square-sq-as-stock-jumps-again?cid=CS-BENZ-FT-325896,Zacks,,,,,,
2018-10-02T08:00:00.000+08:00,"BofA's Branch Expansion, Loan Growth Offset Fee Income Woes",JPM,http://www.zacks.com/stock/news/325776/bofas-branch-expansion-loan-growth-offset-fee-income-woes?cid=CS-BENZ-FT-325776,Zacks,,,,,,
2018-10-02T08:00:00.000+08:00,Fed rethinks 'big bank' definition,JPM,https://seekingalpha.com/news/3394341-fed-rethinks-big-bank-definition?source=partner_benzinga,Seeking Alpha,,,,,,
2018-10-02T08:00:00.000+08:00,"New Preferred Stock IPOs, September 2018",JPM,https://seekingalpha.com/article/4209250-new-preferred-stock-ipos-september-2018?source=partner_benzinga,Seeking Alpha,,,,,,
2018-10-03T08:00:00.000+08:00,"Bank stocks gain as Treasuries, homebuilders sink",JPM,https://seekingalpha.com/news/3394950-bank-stocks-gain-treasuries-homebuilders-sink?source=partner_benzinga,Seeking Alpha,,,,,,
2018-10-03T08:00:00.000+08:00,What Will Trigger The Next Bear Market?,JPM,https://seekingalpha.com/article/4209636-will-trigger-next-bear-market?source=partner_benzinga,Seeking Alpha,,,,,,
2018-10-03T08:00:00.000+08:00,Second-tier U.S. banks may be ripe to get back into M&A: Wells Fargo report,JPM,https://seekingalpha.com/news/3394835-second-tier-u-s-banks-may-ripe-get-back-m-wells-fargo-report?source=partner_benzinga,Seeking Alpha,,,,,,
2018-10-03T08:00:00.000+08:00,JPMorgan Chase goes ex-dividend tomorrow,JPM,https://seekingalpha.com/news/3394804-jpmorgan-chase-goes-ex-dividend-tomorrow?source=partner_benzinga,Seeking Alpha,,,,,,
2018-10-03T08:00:00.000+08:00,"JPMorgan to Expand in New England Region, Open 60 Branches",JPM,http://www.zacks.com/stock/news/325981/jpmorgan-to-expand-in-new-england-region-open-60-branches?cid=CS-BENZ-FT-325981,Zacks,,,,,,
2018-10-03T08:00:00.000+08:00,Big Day For Fedspeak (Wall Street Breakfast Podcast),JPM,https://seekingalpha.com/article/4209571-big-day-fedspeak-wall-street-breakfast-podcast?source=partner_benzinga,Seeking Alpha,,,,,,
2018-10-03T08:00:00.000+08:00,Wall Street Breakfast: Big Day For Fedspeak,JPM,https://seekingalpha.com/article/4209555-wall-street-breakfast-big-day-fedspeak?source=partner_benzinga,Seeking Alpha,,,,,,
2018-10-03T08:00:00.000+08:00,Dimon: Shareholder meetings are a 'farce',JPM,https://seekingalpha.com/news/3394660-dimon-shareholder-meetings-farce?source=partner_benzinga,Seeking Alpha,,,,,,
2018-10-04T08:00:00.000+08:00,US –…-Year Treasury Yield Nears 7-year High,JPM,http://www.gurufocus.com/news/748700/us-10year-treasury-yield-nears-7year-high,GuruFocus,,,,,,
2018-10-04T08:00:00.000+08:00,"JPMorgan, SVB Financial Near Buy Points With Jobs Report Due: Investing Action Plan",JPM,http://www.investors.com/research/investing-action-plan/jobs-report-bank-stocks-jpmorgan-citigroup-near-buy-points/?src=A00237A&ven=BenzingaCP&src=AURLAAM,Investor's Business Daily,,,,,,
2018-10-04T08:00:00.000+08:00,U.S. Stock Market Dives On Troubling News,JPM,http://www.investors.com/market-trend/stock-market-today/stock-market-laggards/?src=A00237A&ven=BenzingaCP&src=AURLAAM,Investor's Business Daily,,,,,,
2018-10-04T08:00:00.000+08:00,"Waverton Investment Management Ltd Buys Intuit Inc, The Home Depot Inc, Union Pacific Corp, ...",JPM,http://www.gurufocus.com/news/748686/waverton-investment-management-ltd-buys-intuit-inc-the-home-depot-inc-union-pacific-corp-sells-lockheed-martin-corp-korea-electric-power-corp-applied-materials-inc,GuruFocus,,,,,,
2018-10-04T08:00:00.000+08:00,"Stock Market News For Oct 4, 2018",JPM,http://www.zacks.com/stock/news/326266/stock-market-news-for-oct-4-2018?cid=CS-BENZ-FT-326266,Zacks,,,,,,
2018-10-04T08:00:00.000+08:00,Is More Regulatory Relief on the Cards for Bigger Banks?,JPM,http://www.zacks.com/stock/news/326209/is-more-regulatory-relief-on-the-cards-for-bigger-banks?cid=CS-BENZ-FT-326209,Zacks,,,,,,
2018-10-04T08:00:00.000+08:00,"My Dividend Growth Portfolio - 35 Holdings, 6 Sells, 2 Buys",JPM,https://seekingalpha.com/article/4209765-dividend-growth-portfolio-35-holdings-6-sells-2-buys?source=partner_benzinga,Seeking Alpha,,,,,,
2018-10-05T08:00:00.000+08:00,5 Most-Held Financial Stocks as Interest Rates Set to Rise,JPM,http://www.gurufocus.com/news/749414/5-mostheld-financial-stocks-as-interest-rates-set-to-rise,GuruFocus,,,,,,
2018-10-05T08:00:00.000+08:00,US Jobless Rate Falls to a 48-Year Low - Rate Rises Ahead?,JPM,http://www.gurufocus.com/news/749346/us-jobless-rate-falls-to-a-48year-low--rate-rises-ahead,GuruFocus,,,,,,
2018-10-05T08:00:00.000+08:00,"Elm Advisors, Llc Buys Wells Fargo, Chevron Corp, Agilent Technologies Inc",JPM,http://www.gurufocus.com/news/749398/elm-advisors-llc-buys-wells-fargo-chevron-corp-agilent-technologies-inc,GuruFocus,,,,,,
2018-10-05T08:00:00.000+08:00,Everything You Need To Know For The Stock Market Next Week: Investing Action Plan,JPM,http://www.investors.com/research/investing-action-plan/earnings-season-q3-results-banks-delta-cannabis-drinks/?src=A00237A&ven=BenzingaCP&src=AURLAAM,Investor's Business Daily,,,,,,
2018-10-05T08:00:00.000+08:00,"Upcoming Earnings to Watch: WBA, DAL, JPM",JPM,http://www.zacks.com/stock/news/326538/upcoming-earnings-to-watch-wba-dal-jpm?cid=CS-BENZ-FT-326538,Zacks,,,,,,
2018-10-05T08:00:00.000+08:00,JPMorgan Chase laying off about 400 mortgage employees: WSJ,JPM,https://seekingalpha.com/news/3395500-jpmorgan-chase-laying-400-mortgage-employees-wsj?source=partner_benzinga,Seeking Alpha,,,,,,
