Date,Article_title,Stock_symbol,Url,Publisher,Author,Article,Lsa_summary,Luhn_summary,Textrank_summary,Lexrank_summary
2019-01-31T08:00:00.000+08:00,"Facebook leads surging Nasdaq, while banks stumble",JPM,https://seekingalpha.com/news/3428216-facebook-leads-surging-nasdaq-banks-stumble?source=partner_benzinga,Seeking Alpha,,,,,,
2019-01-31T08:00:00.000+08:00,"The Tao Of Dogs Of The Dow: Load, Then Rinse And Repeat Next Year",JPM,https://seekingalpha.com/article/4237035-tao-dogs-dow-load-rinse-repeat-next-year?source=partner_benzinga,Seeking Alpha,,,,,,
2019-02-01T08:00:00.000+08:00,Participate In Equity Growth With A 6% Distribution Yield,JPM,https://seekingalpha.com/article/4237538-participate-equity-growth-6-percent-distribution-yield?source=partner_benzinga,Seeking Alpha,,,,,,
2019-02-01T08:00:00.000+08:00,"SocGen downgrades Goldman, Morgan Stanley to Sell",JPM,https://seekingalpha.com/news/3428773-socgen-downgrades-goldman-morgan-stanley-sell?source=partner_benzinga,Seeking Alpha,,,,,,
2019-02-04T08:00:00.000+08:00,JPMorgan Chase: 6.00% From This Preferred Stock IPO,JPM,https://seekingalpha.com/article/4237943-jpmorgan-chase-6_00-percent-preferred-stock-ipo?source=partner_benzinga,Seeking Alpha,,,,,,
2019-02-04T08:00:00.000+08:00,How To Construct A Crash-Resistant Income Portfolio,JPM,https://seekingalpha.com/article/4237815-construct-crash-resistant-income-portfolio?source=partner_benzinga,Seeking Alpha,,,,,,
2019-02-04T08:00:00.000+08:00,"New Preferred Stock IPOs, January 2019",JPM,https://seekingalpha.com/article/4237752-new-preferred-stock-ipos-january-2019?source=partner_benzinga,Seeking Alpha,,,,,,
2019-02-04T08:00:00.000+08:00,"Farewell To A Disappointing Year, When Nothing Much Worked",JPM,https://seekingalpha.com/article/4237790-farewell-disappointing-year-nothing-much-worked?source=partner_benzinga,Seeking Alpha,,,,,,
2019-02-05T08:00:00.000+08:00,Undervalued Dividend Growth Stocks: February 2019,JPM,https://seekingalpha.com/article/4238208-undervalued-dividend-growth-stocks-february-2019?source=partner_benzinga,Seeking Alpha,,,,,,
2019-02-05T08:00:00.000+08:00,ClearBridge Large Cap Value Strategy Portfolio Manager Commentary Q4 2018,JPM,https://seekingalpha.com/article/4238080-clearbridge-large-cap-value-strategy-portfolio-manager-commentary-q4-2018?source=partner_benzinga,Seeking Alpha,,,,,,
2019-02-05T08:00:00.000+08:00,Dividend Portfolio Review: 22% Y/Y Growth In January,JPM,https://seekingalpha.com/article/4238044-dividend-portfolio-review-22-percent-y-y-growth-january?source=partner_benzinga,Seeking Alpha,,,,,,
2019-02-06T08:00:00.000+08:00,Guess Which Stocks Warren Buffett Bought: 4th-Quarter Contest,JPM,http://www.gurufocus.com/news/811596/guess-which-stocks-warren-buffett-bought-4thquarter-contest,GuruFocus,,,,,,
2019-02-07T08:00:00.000+08:00,JPMorgan gets caught up in Venezuelan struggle,JPM,https://seekingalpha.com/news/3430995-jpmorgan-gets-caught-venezuelan-struggle?source=partner_benzinga,Seeking Alpha,,,,,,
2019-02-07T08:00:00.000+08:00,"My Dividend Growth Portfolio Update: 32 Holdings, 3 Buys, 1 Sale",JPM,https://seekingalpha.com/article/4238912-dividend-growth-portfolio-update-32-holdings-3-buys-1-sale?source=partner_benzinga,Seeking Alpha,,,,,,
2019-02-08T08:00:00.000+08:00,US Market Indexes Close Mostly Flat Friday,JPM,http://www.gurufocus.com/news/813012/us-market-indexes-close-mostly-flat-friday,GuruFocus,,,,,,
2019-02-08T08:00:00.000+08:00,"BB&T Shifts Gears In A Huge Way, Announcing A Value-Creating Mega-Merger With SunTrust",JPM,https://seekingalpha.com/article/4239488-bb-and-t-shifts-gears-huge-way-announcing-value-creating-mega-merger-suntrust?source=partner_benzinga,Seeking Alpha,,,,,,
2019-02-08T08:00:00.000+08:00,Berkshire Hathaway Tops Warren Buffett's Wishlist,JPM,http://www.gurufocus.com/news/812782/berkshire-hathaway-tops-warren-buffetts-wishlist,GuruFocus,,,,,,
2019-02-10T08:00:00.000+08:00,Visualizing The World's Most Valuable Bank Brands,JPM,https://www.benzinga.com/node/13134943,TalkMarkets,,,,,,
2019-02-11T08:00:00.000+08:00,Warren Buffett Is Loading Up On Bank Stocks: This Might Be Why,JPM,https://seekingalpha.com/article/4239971-warren-buffett-loading-bank-stocks-might?source=partner_benzinga,Seeking Alpha,,,,,,
2019-02-11T08:00:00.000+08:00,WisdomTree explored a sale late last year: Bloomberg,JPM,https://seekingalpha.com/news/3431775-wisdomtree-explored-sale-late-last-year-bloomberg?source=partner_benzinga,Seeking Alpha,,,,,,
2019-02-11T08:00:00.000+08:00,Sector Allocation Strategy: Energy Is Revving Up For A Run,JPM,https://seekingalpha.com/article/4239613-sector-allocation-strategy-energy-revving-run?source=partner_benzinga,Seeking Alpha,,,,,,
2019-02-12T08:00:00.000+08:00,Stock Market Rally Charges Ahead; This Top Growth Stock Breaks Out,JPM,http://www.investors.com/market-trend/stock-market-today/dow-jones-stock-market-rally-lululemon-stock-buy/?src=A00237A&ven=BenzingaCP&src=AURLAAM,Investor's Business Daily,,,,,,
2019-02-12T08:00:00.000+08:00,WisdomTree Delays Plan to Explore Sale Until Shares Rebound,JPM,http://www.zacks.com/stock/news/353742/wisdomtree-delays-plan-to-explore-sale-until-shares-rebound?cid=CS-BENZ-FT-353742,Zacks,,,,,,
2019-02-13T08:00:00.000+08:00,How To Monitor Your Dividend Growth Portfolio,JPM,https://seekingalpha.com/article/4240798-monitor-dividend-growth-portfolio?source=partner_benzinga,Seeking Alpha,,,,,,
2019-02-13T08:00:00.000+08:00,Barclays makes another hire from JPMorgan: New York Post,JPM,https://seekingalpha.com/news/3432805-barclays-makes-another-hire-jpmorgan-new-york-post?source=partner_benzinga,Seeking Alpha,,,,,,
2019-02-13T08:00:00.000+08:00,5 Stocks That Prove Size Does Matter in 2019,JPM,http://www.zacks.com/stock/news/354112/5-stocks-that-prove-size-does-matter-in-2019?cid=CS-BENZ-FT-354112,Zacks,,,,,,
2019-02-13T08:00:00.000+08:00,Buffett's Barbell With An Educational Twist Is Perfect For A Thrifty 19-Year-Old: 90% S&P 500 Index And 10% I Bonds For Cash,JPM,https://seekingalpha.com/article/4240486-buffetts-barbell-educational-twist-perfect-thrifty-19-year-old-90-percent-s-and-p-500-index?source=partner_benzinga,Seeking Alpha,,,,,,
2019-02-14T08:00:00.000+08:00,"The Zacks Analyst Blog Highlights: Boeing, Microsoft, Amazon, Walmart and JPMorgan",JPM,http://www.zacks.com/stock/news/354790/the-zacks-analyst-blog-highlights-boeing-microsoft-amazon-walmart-and-jpmorgan?cid=CS-BENZ-FT-354790,Zacks,,,,,,
2019-02-14T08:00:00.000+08:00,Wells Fargo boosts JPMorgan price target to $130,JPM,https://seekingalpha.com/news/3433393-wells-fargo-boosts-jpmorgan-price-target-130?source=partner_benzinga,Seeking Alpha,,,,,,
2019-02-14T08:00:00.000+08:00,JPMorgan creates its own cryptocurrency,JPM,https://seekingalpha.com/news/3433364-jpmorgan-creates-cryptocurrency?source=partner_benzinga,Seeking Alpha,,,,,,
2019-02-15T08:00:00.000+08:00,Stocks Close Higher Friday With Spending Deal and National Emergency Declaration,JPM,http://www.gurufocus.com/news/817516/stocks-close-higher-friday-with-spending-deal-and-national-emergency-declaration,GuruFocus,,,,,,
2019-02-15T08:00:00.000+08:00,"Berkshire Hathaway Buys JPMorgan Chase & Co, Red Hat Inc, General Motors Co, Sells Oracle ...",JPM,http://www.gurufocus.com/news/817395/berkshire-hathaway-buys-jpmorgan-chase--co-red-hat-inc-general-motors-co-sells-oracle-corp-wells-fargo--co-apple-inc,GuruFocus,,,,,,
2019-02-15T08:00:00.000+08:00,Wells Fargo CEO seen testifying in House in March,JPM,https://seekingalpha.com/news/3434065-wells-fargo-ceo-seen-testifying-house-march?source=partner_benzinga,Seeking Alpha,,,,,,
2019-02-15T08:00:00.000+08:00,"A round-up of January credit-card delinquency, charge-off rates",JPM,https://seekingalpha.com/news/3433995-round-january-credit-card-delinquency-charge-rates?source=partner_benzinga,Seeking Alpha,,,,,,
2019-02-15T08:00:00.000+08:00,Lazard: This Mid-Cap Stock Is Priced For A Recession,JPM,https://seekingalpha.com/article/4241423-lazard-mid-cap-stock-priced-recession?source=partner_benzinga,Seeking Alpha,,,,,,
2019-02-15T08:00:00.000+08:00,Tracking Warren Buffett's Berkshire Hathaway Portfolio - Q4 2018 Update,JPM,https://seekingalpha.com/article/4241396-tracking-warren-buffetts-berkshire-hathaway-portfolio-q4-2018-update?source=partner_benzinga,Seeking Alpha,,,,,,
2019-02-15T08:00:00.000+08:00,Dow Looks To Reignite Winning Streak (Wall Street Breakfast Podcast),JPM,https://seekingalpha.com/article/4241391-dow-looks-reignite-winning-streak-wall-street-breakfast-podcast?source=partner_benzinga,Seeking Alpha,,,,,,
2019-02-15T08:00:00.000+08:00,"\"JPMorgan (JPM) Plans to Launch \"\"JPM Coin\"\" Using Blockchain\"",JPM,http://www.zacks.com/stock/news/354940/jpmorgan-jpm-plans-to-launch-jpm-coin-using-blockchain?cid=CS-BENZ-FT-354940,Zacks,,,,,,
2019-02-15T08:00:00.000+08:00,Wall Street Breakfast: Dow Looks To Reignite Winning Streak,JPM,https://seekingalpha.com/article/4241375-wall-street-breakfast-dow-looks-reignite-winning-streak?source=partner_benzinga,Seeking Alpha,,,,,,
2019-02-16T08:00:00.000+08:00,Week 8 Breakout Forecast: Short-Term Picks To Give You An Edge,JPM,https://seekingalpha.com/article/4241664-week-8-breakout-forecast-short-term-picks-give-edge?source=partner_benzinga,Seeking Alpha,,,,,,
2019-02-16T08:00:00.000+08:00,How To Get High Growth With Half The Risk,JPM,https://seekingalpha.com/article/4241048-get-high-growth-half-risk?source=partner_benzinga,Seeking Alpha,,,,,,
2019-02-17T08:00:00.000+08:00,46 Fortune Most Admired Public Co's By Yield & Target Gains For February 2020,JPM,https://seekingalpha.com/article/4241725-46-fortune-admired-public-cos-yield-and-target-gains-february-2020?source=partner_benzinga,Seeking Alpha,,,,,,
2019-02-17T08:00:00.000+08:00,Dogs of the Dow and a 3 Top Dogs Strategy,JPM,https://www.benzinga.com/node/13194357,TalkMarkets,,,,,,
2019-02-18T08:00:00.000+08:00,Analysis Of Berkshire Hathaway Holdings Q4 2018,JPM,https://seekingalpha.com/article/4241968-analysis-berkshire-hathaway-holdings-q4-2018?source=partner_benzinga,Seeking Alpha,,,,,,
2019-02-18T08:00:00.000+08:00,"Berkshire's Revealing 13F: Buffett Didn't Buy The Dip - Didn't Add To Apple, Sold Oracle, Bought Banks",JPM,https://seekingalpha.com/article/4241888-berkshires-revealing-13f-buffett-buy-dip-add-apple-sold-oracle-bought-banks?source=partner_benzinga,Seeking Alpha,,,,,,
2019-02-18T08:00:00.000+08:00,Citigroup (C) Raises CEO Corbat's 2018 Compensation by 4.35%,JPM,http://www.zacks.com/stock/news/355285/citigroup-c-raises-ceo-corbats-2018-compensation-by-435?cid=CS-BENZ-FT-355285,Zacks,,,,,,
2019-02-19T08:00:00.000+08:00,The Best Dividend Stocks For New Money Today,JPM,https://seekingalpha.com/article/4242310-best-dividend-stocks-new-money-today?source=partner_benzinga,Seeking Alpha,,,,,,
2019-02-19T08:00:00.000+08:00,Channeling Warren Buffett,JPM,http://www.gurufocus.com/news/818629/channeling-warren-buffett,GuruFocus,,,,,,
2019-02-19T08:00:00.000+08:00,World Banks' And Corporations' Interest Is Shifting From Cryptocurrencies To Blockchain,JPM,https://seekingalpha.com/article/4242079-world-banks-corporations-interest-shifting-cryptocurrencies-blockchain?source=partner_benzinga,Seeking Alpha,,,,,,
2019-02-19T08:00:00.000+08:00,Invest Like Warren Buffet With These Bank ETFs,JPM,http://www.zacks.com/stock/news/355466/invest-like-warren-buffet-with-these-bank-etfs?cid=CS-BENZ-FT-355466,Zacks,,,,,,
2019-02-19T08:00:00.000+08:00,"Stock Market News For Feb 19, 2019",JPM,http://www.zacks.com/stock/news/355457/stock-market-news-for-feb-19-2019?cid=CS-BENZ-FT-355457,Zacks,,,,,,
2019-02-19T08:00:00.000+08:00,"Berkshire Hathaway Q4 Earnings, Q4 And Current Book Value Estimates",JPM,https://seekingalpha.com/article/4242043-berkshire-hathaway-q4-earnings-q4-current-book-value-estimates?source=partner_benzinga,Seeking Alpha,,,,,,
2019-02-19T08:00:00.000+08:00,What Are The Highest Quality Dividend Growth Stocks?,JPM,https://seekingalpha.com/article/4242014-highest-quality-dividend-growth-stocks?source=partner_benzinga,Seeking Alpha,,,,,,
2019-02-20T08:00:00.000+08:00,JPMorgan Chase (JPM) Outpaces Stock Market Gains: What You Should Know,JPM,http://www.zacks.com/stock/news/355829/jpmorgan-chase-jpm-outpaces-stock-market-gains-what-you-should-know?cid=CS-BENZ-FT-355829,Zacks,,,,,,
2019-02-20T08:00:00.000+08:00,Road To Financial Independence: Dissecting Dividends Into Their Components,JPM,https://seekingalpha.com/article/4242336-road-financial-independence-dissecting-dividends-components?source=partner_benzinga,Seeking Alpha,,,,,,
2019-02-20T08:00:00.000+08:00,"Why I Look For Dividend Growth, Not Just Dividend Safety",JPM,https://seekingalpha.com/article/4242334-look-dividend-growth-just-dividend-safety?source=partner_benzinga,Seeking Alpha,,,,,,
2019-02-21T08:00:00.000+08:00,Does Warren Buffett Still Believe In Wells Fargo?,JPM,https://seekingalpha.com/article/4242913-warren-buffett-still-believe-wells-fargo?source=partner_benzinga,Seeking Alpha,,,,,,
2019-02-21T08:00:00.000+08:00,"\"Philadelphia sues seven banks over muni deal \"\"collusion\"\": Bloomberg\"",JPM,https://seekingalpha.com/news/3435662-philadelphia-sues-seven-banks-muni-deal-collusion-bloomberg?source=partner_benzinga,Seeking Alpha,,,,,,
2019-02-21T08:00:00.000+08:00,"Dow Set To Retake Perch Above 26,000 (Wall Street Breakfast Podcast)",JPM,https://seekingalpha.com/article/4242811-dow-set-retake-perch-26000-wall-street-breakfast-podcast?source=partner_benzinga,Seeking Alpha,,,,,,
2019-02-21T08:00:00.000+08:00,"Wall Street Breakfast: Dow Set To Retake Perch Above 26,000",JPM,https://seekingalpha.com/article/4242793-wall-street-breakfast-dow-set-retake-perch-26000?source=partner_benzinga,Seeking Alpha,,,,,,
2019-02-21T08:00:00.000+08:00,Details on Amazon-Berkshire-JPMorgan health JV,JPM,https://seekingalpha.com/news/3435451-details-amazon-berkshire-jpmorgan-health-jv?source=partner_benzinga,Seeking Alpha,,,,,,
2019-02-21T08:00:00.000+08:00,Tracking George Soros's Portfolio - Q4 2018 Update,JPM,https://seekingalpha.com/article/4242753-tracking-george-soross-portfolio-q4-2018-update?source=partner_benzinga,Seeking Alpha,,,,,,
2019-02-22T08:00:00.000+08:00,Why Square (SQ) Stock Looks Like a Buy Heading into Q4 Earnings,JPM,http://www.zacks.com/stock/news/356641/why-square-sq-stock-looks-like-a-buy-heading-into-q4-earnings?cid=CS-BENZ-FT-356641,Zacks,,,,,,
2019-02-22T08:00:00.000+08:00,Judge won't block hire by Amazon-Berkshire-JPMorgan health JV,JPM,https://seekingalpha.com/news/3436283-judge-block-hire-amazon-berkshire-jpmorgan-health-jv?source=partner_benzinga,Seeking Alpha,,,,,,
2019-02-22T08:00:00.000+08:00,"JPMorgan: Near 10% Annual Return From A Great Franchise, Buy",JPM,https://seekingalpha.com/article/4243333-jpmorgan-near-10-percent-annual-return-great-franchise-buy?source=partner_benzinga,Seeking Alpha,,,,,,
2019-02-22T08:00:00.000+08:00,"JPMorgan: Near 10% Annual Return From A Great Franchise, Buy",JPM,https://seekingalpha.com/article/4243333-jpmorgan-near-10-percent-annual-return-great-franchise-buy?source=partner_benzinga,Seeking Alpha,,,,,,
2019-02-22T08:00:00.000+08:00,Berkshire Hathaway Is Consuming A Very Bitter Ketchup From Kraft Heinz,JPM,https://seekingalpha.com/article/4243330-berkshire-hathaway-consuming-bitter-ketchup-kraft-heinz?source=partner_benzinga,Seeking Alpha,,,,,,
2019-02-22T08:00:00.000+08:00,Philadelphia Sues 7 Big Banks Over 'Muni' Bond Collusion,JPM,http://www.zacks.com/stock/news/356398/philadelphia-sues-7-big-banks-over-muni-bond-collusion?cid=CS-BENZ-FT-356398,Zacks,,,,,,
2019-02-22T08:00:00.000+08:00,"Dow 30 Stock Roundup: WMT Earnings Beat, MRK's Keytruda sBLA Gets Priority Review",JPM,http://www.zacks.com/stock/news/356394/dow-30-stock-roundup-wmt-earnings-beat-mrks-keytruda-sbla-gets-priority-review?cid=CS-BENZ-FT-356394,Zacks,,,,,,
2019-02-22T08:00:00.000+08:00,Central Bank Filled Week (Wall Street Breakfast Podcast),JPM,https://seekingalpha.com/article/4243239-central-bank-filled-week-wall-street-breakfast-podcast?source=partner_benzinga,Seeking Alpha,,,,,,
2019-02-22T08:00:00.000+08:00,Wall Street Breakfast: Central Bank-Filled Week Comes To A Close,JPM,https://seekingalpha.com/article/4243235-wall-street-breakfast-central-bank-filled-week-comes-close?source=partner_benzinga,Seeking Alpha,,,,,,
2019-02-22T08:00:00.000+08:00,Top 10 S&P 500 Stocks: How Does Forward Earnings Growth Look?,JPM,https://seekingalpha.com/article/4243224-top-10-s-and-p-500-stocks-forward-earnings-growth-look?source=partner_benzinga,Seeking Alpha,,,,,,
2019-02-23T08:00:00.000+08:00,Stocks To Watch: Food For Thought,JPM,https://seekingalpha.com/article/4243582-stocks-watch-food-thought?source=partner_benzinga,Seeking Alpha,,,,,,
2019-02-23T08:00:00.000+08:00,Tracking Glenn Greenberg's Brave Warrior Advisors Portfolio - Q4 2018 Update,JPM,https://seekingalpha.com/article/4243570-tracking-glenn-greenbergs-brave-warrior-advisors-portfolio-q4-2018-update?source=partner_benzinga,Seeking Alpha,,,,,,
2019-02-23T08:00:00.000+08:00,"When Assessing Portfolio Risk, Look Beyond Sectors And Industries",JPM,https://seekingalpha.com/article/4243552-assessing-portfolio-risk-look-beyond-sectors-industries?source=partner_benzinga,Seeking Alpha,,,,,,
2019-02-24T08:00:00.000+08:00,Food For Thought (Stocks To Watch Podcast),JPM,https://seekingalpha.com/article/4243646-food-thought-stocks-watch-podcast?source=partner_benzinga,Seeking Alpha,,,,,,
2019-02-24T08:00:00.000+08:00,"Market Briefing For Monday, Feb. 25",JPM,https://www.benzinga.com/node/13232751,TalkMarkets,,,,,,
2019-02-25T08:00:00.000+08:00,JPMorgan: Buy Or Sell?,JPM,https://seekingalpha.com/article/4244059-jpmorgan-buy-sell?source=partner_benzinga,Seeking Alpha,,,,,,
2019-02-25T08:00:00.000+08:00,Caterpillar Leads Dow Jones; China Stocks Explode Higher On Trade Progress,JPM,http://www.investors.com/market-trend/stock-market-today/dow-jones-today-caterpillar-stock-china-tariffs/?src=A00237A&ven=BenzingaCP&src=AURLAAM,Investor's Business Daily,,,,,,
2019-02-25T08:00:00.000+08:00,JPMorgan Asset Management names sustainable investing head,JPM,https://seekingalpha.com/news/3436610-jpmorgan-asset-management-names-sustainable-investing-head?source=partner_benzinga,Seeking Alpha,,,,,,
2019-02-25T08:00:00.000+08:00,"The Zacks Analyst Blog Highlights: JPMorgan, Citigroup, Bank of America, Goldman Sachs and Wells Fargo",JPM,http://www.zacks.com/stock/news/356844/the-zacks-analyst-blog-highlights-jpmorgan-citigroup-bank-of-america-goldman-sachs-and-wells-fargo?cid=CS-BENZ-FT-356844,Zacks,,,,,,
2019-02-25T08:00:00.000+08:00,5 Stocks to Gain From Rising Use of Mobile Payments,JPM,http://www.zacks.com/stock/news/356724/5-stocks-to-gain-from-rising-use-of-mobile-payments?cid=CS-BENZ-FT-356724,Zacks,,,,,,
2019-02-25T08:00:00.000+08:00,Buffett Letter: Buybacks Up To $207 Per Berkshire B Share Hint At Intrinsic Value; Prices For Acquisitions Are 'Sky-High',JPM,https://seekingalpha.com/article/4243775-buffett-letter-buybacks-207-per-berkshire-b-share-hint-intrinsic-value-prices-acquisitions?source=partner_benzinga,Seeking Alpha,,,,,,
2019-02-26T08:00:00.000+08:00,"What to Expect from Square's (SQ) Q4 Earnings, Revenue & Payment Volume",JPM,http://www.zacks.com/stock/news/357029/what-to-expect-from-squares-sq-q4-earnings-revenue-payment-volume?cid=CS-BENZ-FT-357029,Zacks,,,,,,
2019-02-26T08:00:00.000+08:00,"US Market Indexes Close Lower Tuesday, Ending —-Day Rally",JPM,http://www.gurufocus.com/news/823728/us-market-indexes-close-lower-tuesday-ending-2day-rally,GuruFocus,,,,,,
2019-02-26T08:00:00.000+08:00,JPMorgan Chase & Co. (JPM) Investor Presentation - Slideshow,JPM,https://seekingalpha.com/article/4244269-jpmorgan-chase-and-co-jpm-investor-presentation-slideshow?source=partner_benzinga,Seeking Alpha,,,,,,
2019-02-26T08:00:00.000+08:00,"JPMorgan Slides After Bank Reveals Slower Loan, Deposit Growth",JPM,https://www.benzinga.com/node/13247121,TalkMarkets,,,,,,
2019-02-26T08:00:00.000+08:00,"Bank of Hawaii CEO's Base Salary Up 3%, Gets Incentive Bonus",JPM,http://www.zacks.com/stock/news/356998/bank-of-hawaii-ceos-base-salary-up-3-gets-incentive-bonus?cid=CS-BENZ-FT-356998,Zacks,,,,,,
2019-02-26T08:00:00.000+08:00,"The Zacks Analyst Blog Highlights: Square, Alibaba, Tencent, Bank of America and JPMorgan Chase",JPM,http://www.zacks.com/stock/news/356961/the-zacks-analyst-blog-highlights-square-alibaba-tencent-bank-of-america-and-jpmorgan-chase?cid=CS-BENZ-FT-356961,Zacks,,,,,,
2019-02-26T08:00:00.000+08:00,"\"JPMorgan sees slower deposit growth, \"\"steady state\"\" NII\"",JPM,https://seekingalpha.com/news/3437042-jpmorgan-sees-slower-deposit-growth-steady-state-nii?source=partner_benzinga,Seeking Alpha,,,,,,
2019-02-27T08:00:00.000+08:00,The Strong Look To Get Stronger As JPMorgan Continues To Target Growth,JPM,https://seekingalpha.com/article/4245008-strong-look-get-stronger-jpmorgan-continues-target-growth?source=partner_benzinga,Seeking Alpha,,,,,,
2019-02-27T08:00:00.000+08:00,"JPMorgan Affirms Profitability Goals, Expects Costs to Rise",JPM,http://www.zacks.com/stock/news/357164/jpmorgan-affirms-profitability-goals-expects-costs-to-rise?cid=CS-BENZ-FT-357164,Zacks,,,,,,
2019-02-27T08:00:00.000+08:00,Berkshire Stocks Up on American Banks: Here's Why,JPM,http://www.zacks.com/stock/news/357139/berkshire-stocks-up-on-american-banks-heres-why?cid=CS-BENZ-FT-357139,Zacks,,,,,,
2019-02-28T08:00:00.000+08:00,The Bow Wow Dow: IBM Tops By Yield; DowDuPont Tops Broker Targets,JPM,https://seekingalpha.com/article/4245460-bow-wow-dow-ibm-tops-yield-dowdupont-tops-broker-targets?source=partner_benzinga,Seeking Alpha,,,,,,
2019-02-28T08:00:00.000+08:00,Key Levels We're Trading In Financial Stocks,JPM,https://www.benzinga.com/node/13274671,TalkMarkets,,,,,,
2019-02-28T08:00:00.000+08:00,Zero Fee ETFs: What You Need to Know,JPM,http://www.zacks.com/stock/news/357337/zero-fee-etfs-what-you-need-to-know?cid=CS-BENZ-FT-357337,Zacks,,,,,,
2019-02-28T08:00:00.000+08:00,JPMorgan considers private bank in China,JPM,https://seekingalpha.com/news/3438686-jpmorgan-considers-private-bank-china?source=partner_benzinga,Seeking Alpha,,,,,,
2019-02-28T08:00:00.000+08:00,EU Rolls Out Strict Rules for Foreign-based Investment Managers,JPM,http://www.zacks.com/stock/news/357306/eu-rolls-out-strict-rules-for-foreign-based-investment-managers?cid=CS-BENZ-FT-357306,Zacks,,,,,,
2019-02-28T08:00:00.000+08:00,"The Zacks Analyst Blog Highlights: Berkshire Hathaway, Bank of America, US Bancorp, JPMorgan Chase and Bank of New York Mellon",JPM,http://www.zacks.com/stock/news/357257/the-zacks-analyst-blog-highlights-berkshire-hathaway-bank-of-america-us-bancorp-jpmorgan-chase-and-bank-of-new-york-mellon?cid=CS-BENZ-FT-357257,Zacks,,,,,,
2019-03-01T08:00:00.000+08:00,Julian Robertson Buys — Stocks as He Slashes Portfolio,JPM,http://www.gurufocus.com/news/826241/julian-robertson-buys-2-stocks-as-he-slashes-portfolio,GuruFocus,,,,,,
2019-03-01T08:00:00.000+08:00,"Top Stock Reports for Facebook, Johnson & Johnson & JPMorgan",JPM,http://www.zacks.com/research-daily/217355/top-stock-reports-for-facebook-johnson-johnson-jpmorgan?cid=CS-BENZ-FT-217355,Zacks,,,,,,
2019-03-01T08:00:00.000+08:00,John's January Retirement Account Update - Locking In Gains As Stocks Move To 52-Week Highs,JPM,https://seekingalpha.com/article/4245702-johns-january-retirement-account-update-locking-gains-stocks-move-52-week-highs?source=partner_benzinga,Seeking Alpha,,,,,,
2019-03-01T08:00:00.000+08:00,February Portfolio Update - Banks And Cars,JPM,https://seekingalpha.com/article/4245687-february-portfolio-update-banks-cars?source=partner_benzinga,Seeking Alpha,,,,,,
2019-03-01T08:00:00.000+08:00,China A-Shares ETFs to Roar Higher on MSCI Move,JPM,http://www.zacks.com/stock/news/357456/china-a-shares-etfs-to-roar-higher-on-msci-move?cid=CS-BENZ-FT-357456,Zacks,,,,,,
2019-03-01T08:00:00.000+08:00,B. Riley's 6.88% Bonds: An Investment For Whatever The Fed Throws At Us,JPM,https://seekingalpha.com/article/4245496-b-rileys-6_88-percent-bonds-investment-whatever-fed-throws-us?source=partner_benzinga,Seeking Alpha,,,,,,
2019-03-01T08:00:00.000+08:00,Berkshire's Biggest Risks Are Hard To Analyze: Buffett Needs To Be On Top Of His Game,JPM,https://seekingalpha.com/article/4245654-berkshires-biggest-risks-hard-analyze-buffett-needs-top-game?source=partner_benzinga,Seeking Alpha,,,,,,
2019-03-01T08:00:00.000+08:00,JPMorgan Evaluates Option to Establish Private Bank in China,JPM,http://www.zacks.com/stock/news/357406/jpmorgan-evaluates-option-to-establish-private-bank-in-china?cid=CS-BENZ-FT-357406,Zacks,,,,,,
2019-03-01T08:00:00.000+08:00,JPMorgan Extends Lease to House Staff if No-Deal Brexit Occurs,JPM,http://www.zacks.com/stock/news/357405/jpmorgan-extends-lease-to-house-staff-if-no-deal-brexit-occurs?cid=CS-BENZ-FT-357405,Zacks,,,,,,
2019-03-01T08:00:00.000+08:00,Buffett's Biggest Bet: Why The Big U.S. Banks Are A Good Deal Now,JPM,https://seekingalpha.com/article/4245650-buffetts-biggest-bet-big-u-s-banks-good-deal-now?source=partner_benzinga,Seeking Alpha,,,,,,
2019-03-04T08:00:00.000+08:00,Road To Financial Independence: Rising Dividends And Endless Opportunities,JPM,https://seekingalpha.com/article/4246322-road-financial-independence-rising-dividends-endless-opportunities?source=partner_benzinga,Seeking Alpha,,,,,,
2019-03-04T08:00:00.000+08:00,JPMorgan gets IPO stabilization agent role in Lyft IPO,JPM,https://seekingalpha.com/news/3439650-jpmorgan-gets-ipo-stabilization-agent-role-lyft-ipo?source=partner_benzinga,Seeking Alpha,,,,,,
2019-03-04T08:00:00.000+08:00,Monthly Review Of DivGro: February 2019,JPM,https://seekingalpha.com/article/4246175-monthly-review-divgro-february-2019?source=partner_benzinga,Seeking Alpha,,,,,,
2019-03-04T08:00:00.000+08:00,"The Zacks Analyst Blog Highlights: Facebook, Johnson & Johnson, JPMorgan, Sun Life and Evergy",JPM,http://www.zacks.com/stock/news/357595/the-zacks-analyst-blog-highlights-facebook-johnson-johnson-jpmorgan-sun-life-and-evergy?cid=CS-BENZ-FT-357595,Zacks,,,,,,
